"Foreign, Commonwealth & Development Office","Foreign, Commonwealth & Development Office",G2-SCH-2024-02-14128,Zimbabwe Girls Secondary Education 2012 - 2023,"To strengthen scope and quality of educational service by issuing bursaries, enhance student access, retention and achievement in the secondary cycle with special attention to disadvantaged girls and boys in 1046 schools across 29 districts to complete 4 years secondary education by 2023.  This contributes to the realisation of Global Goal 4.",3563552.00,2022-04-01,2023-03-31,General Grant - Uncompeted,12,Foreign aid,International Development Act 2002
"Foreign, Commonwealth & Development Office","Foreign, Commonwealth & Development Office",G2-SCH-2024-02-14129,Evidence for Development,The Government of Nepal develops and implements policies and programmes based on sound evidence leading to demonstrable poverty reduction and progress towards Least Developed Country (LDC) graduation by 2022.,991007.00,2022-04-01,2023-03-31,General Grant - Uncompeted,12,Foreign aid,International Development Act 2002
"Foreign, Commonwealth & Development Office","Foreign, Commonwealth & Development Office",G2-SCH-2024-02-14130,Support to Bangladeshs National Urban Poverty Reduction Programme (NUPRP),"Improvement in the integration of poor communities into municipal planning, budgeting and management, with a particular focus on women and girls and climate resilience; piloting of options for scale up and lesson learning at national level to inform overall urban policy and poverty reduction",6700000.00,2022-04-01,2023-03-31,General Grant - Uncompeted,12,Foreign aid,International Development Act 2002
"Foreign, Commonwealth & Development Office","Foreign, Commonwealth & Development Office",G2-SCH-2024-02-14131,Tackling Maternal and Child Undernutrition Programme- Phase II,To contribute towards improved health and nutrition status for children under two years measured primarily by a reduction in stunting by 2023.,13494.00,2022-04-01,2023-03-31,General Grant - Uncompeted,12,Foreign aid,International Development Act 2002
"Foreign, Commonwealth & Development Office","Foreign, Commonwealth & Development Office",G2-SCH-2024-02-14132,Ghana Partnerships Beyond Aid Programme,"To improve governance and accountability in Education, Health and Social Protection sectors and contribute to policy and research.",2120108.84,2022-04-01,2023-03-31,General Grant - Uncompeted,12,Foreign aid,International Development Act 2002
"Foreign, Commonwealth & Development Office","Foreign, Commonwealth & Development Office",G2-SCH-2024-02-14133,Anti Corruption Evidence ' ACE' Programme,"The Anti-Corruption Evidence (ACE) programme will deliver new, practical research on 'what works' to tackle corruption in developing countries. Uptake of this new research by DFID and its partners will mean mean that anti-corruption initiatives are more effective and so corruption and leakage are measurably reduced. ACE will focus in 3-4 DFID priority countries drawn from a short list including Ghana, Uganda, Tanzania, Mozambique and Nigeria; and Bangladesh.",2113524.91,2022-04-01,2023-03-31,General Grant - Uncompeted,12,Foreign aid,International Development Act 2002
"Foreign, Commonwealth & Development Office","Foreign, Commonwealth & Development Office",G2-SCH-2024-02-14134,M4D - Mobile for Development Strategic Partnership,"To work jointly with the industry group representing mobile phone operators worldwide, the GSMA, and its subsidiary Mobile for Development, to identify and support the development and use of new, innovative ways in which mobile phone technologies and mobile network infrastructure can be used to improve the reach, delivery and affordability of life-enhancing services to poor people in Africa and Asia. As a result of this work some 14 million poor people are expected to benefit from improved access to life enhancing services by 2020.",0.00,2022-04-01,2023-03-31,General Grant - Uncompeted,12,Foreign aid,International Development Act 2002
"Foreign, Commonwealth & Development Office","Foreign, Commonwealth & Development Office",G2-SCH-2024-02-14135,HiFi - Harnessing Innovation for Financial Inclusion,"To provide access to poor people to a broad range of financial services such as payments, savings, loans, and insurance by continuing to support piloting new ideas and approaches, and to support technical assistance regulators and commercial players for enhancing industry knowledge and practice about business models, pricing and design of financial products. Access to these services enables consumers to acquire productive assets, invest in health and education and make other purchases that enrich their lives.",1637.00,2022-04-01,2023-03-31,General Grant - Uncompeted,12,Foreign aid,International Development Act 2002
"Foreign, Commonwealth & Development Office","Foreign, Commonwealth & Development Office",G2-SCH-2024-02-14136,Pathways to Prosperity for Extremely Poor People in Bangladesh (PPEPP),Pathways to Prosperity for Extremely Poor People in Bangladesh- RDEL,2700000.00,2022-04-01,2023-03-31,General Grant - Uncompeted,12,Foreign aid,International Development Act 2002
"Foreign, Commonwealth & Development Office","Foreign, Commonwealth & Development Office",G2-SCH-2024-02-14137,Comic Relief Red Nose Day 2013  improving the lives of women and girls in sub-Saharan Africa,"Targeted women and girls benefit from improvements in one or more of the following five areas: health, education, agriculture/trade, leadership and advocacy for women's rights and violence against women and girls.",1801887.00,2022-04-01,2023-03-31,General Grant - Uncompeted,12,Foreign aid,International Development Act 2002
"Foreign, Commonwealth & Development Office","Foreign, Commonwealth & Development Office",G2-SCH-2024-02-14138,Humanitarian Assistance and Resilience in South Sudan (HARISS) 2015 - 2024,"To help approximately three million South Sudanese by providing critical life-saving support and helping people to better cope with shocks from conflict, drought and flooding. This programme aims to save the lives of an estimated two million people who will receive at least one form of humanitarian assistance; and build the capacity of an estimated one million people to recover and cope better with shocks.  Over six years this programme will provide food, shelter and access to water and health services to millions of vulnerable people, including women and children.",19944468.69,2022-04-01,2023-03-31,General Grant - Uncompeted,12,Foreign aid,International Development Act 2002
"Foreign, Commonwealth & Development Office","Foreign, Commonwealth & Development Office",G2-SCH-2024-02-14139,Supporting Structural Reform in the Indian Power Sector,"In line with the UK governments aid policy and new development partnership with India, the Supporting Structural Reform in the Indian Power Sector programme will improve the efficiency, reliability and sustainability of electricity supply in India through technical expertise, not through traditional grant support. It will provide world class expertise to support the market reforms and scale up of renewable energy supply that the Indian power sector needs to support growth and create jobs. It will work at the Central level and in upto three States which may include DFID focus states such as Odisha, Andhra Pradesh and Madhya Pradesh.",-5095.00,2022-04-01,2023-03-31,General Grant - Uncompeted,12,Foreign aid,International Development Act 2002
"Foreign, Commonwealth & Development Office","Foreign, Commonwealth & Development Office",G2-SCH-2024-02-14140,UK Collaborative on Development Sciences (UKCDS) Phase 2,UK Collaborative on Development Research (UKCDR) Phase 3 - core funding for staff and activities,264573.09,2022-04-01,2023-03-31,General Grant - Uncompeted,12,Foreign aid,International Development Act 2002
"Foreign, Commonwealth & Development Office","Foreign, Commonwealth & Development Office",G2-SCH-2024-02-14141,Capacity for Economic Research and Policy making in Africa (CERPA),"To increase the  number and quality of MSc and Phd Economics graduates in developing countries involved in research and policy activities,  and to improve ability of developing country researchers to undertake high quality economic research. This will enable developing countries to manage their economies better, which should help them to  achieve higher economic growth.",1200000.00,2022-04-01,2023-03-31,General Grant - Uncompeted,12,Foreign aid,International Development Act 2002
"Foreign, Commonwealth & Development Office","Foreign, Commonwealth & Development Office",G2-SCH-2024-02-14143,Myanmar UK Partnership for Education,"MUPE is to improve the reach and quality of education services in Burma and help prepare Burmas youth with the skills they need for life after school with the focus on English language, teacher education, examination systems, and education in protracted crises where the UK has a particular comparative advantage.  The programme aims to reach up to 51,000 teacher educators, teacher trainees and teachers.  Through Education Reform Facility, it intends to support priority reforms on assessment and examination in Burmas National Education Strategic Plan (NESP) with impact on 9 million children of which support for up to 73,000 will be attributable to FCDO.  And it aims to support improved schooling in conflict-affected and ethnic areas to help 460,000 children in conflict-affected areas access better quality education, of which up to 46,000 attributable to FCDO.",1200000.00,2022-04-01,2023-03-31,General Grant - Uncompeted,12,Foreign aid,International Development Act 2002
"Foreign, Commonwealth & Development Office","Foreign, Commonwealth & Development Office",G2-SCH-2024-02-14144,Excluded People's Rights in Bangladesh,"To promote rights and equality for 1.64 million people in Bangladesh who are at the highest risk of being excluded, including poor women and girls, people with disabilities, ethnic and religious minorities, Dalits (untouchables), children working in vulnerable situations (including modern slavery) and youth. The programme will increasingly focus on social cohesion. The partner supports a network of organisations to defend and enhance poor, minorities and other marginalised peoples rights and enabling them to access to assets, public services (e.g. health, education) and economic opportunities. The programme also works with local level service providers to help them meet their responsibilities and assist communities to monitor their performance. Where opportunities arise, the programme will contribute to the development of policies and laws that uphold the rights of the poor and excluded groups in society. FCDO's flagship rights programme.",2450000.00,2022-04-01,2023-03-31,General Grant - Uncompeted,12,Foreign aid,International Development Act 2002
"Foreign, Commonwealth & Development Office","Foreign, Commonwealth & Development Office",G2-SCH-2024-02-14145,Burma Humanitarian Assistance and Resilience Programme,"To save lives, reduce poverty and suffering of 400,000 crisis affected people in Burma and Burmese refugees in Thailand through providing humanitarian assistance, enhancing resilience and building local and international organisations capacity to respond to future humanitarian need in Burma",2154330.67,2022-04-01,2023-03-31,General Grant - Uncompeted,12,Foreign aid,International Development Act 2002
"Foreign, Commonwealth & Development Office","Foreign, Commonwealth & Development Office",G2-SCH-2024-02-14146,J-PAL Education Initiative,"The JPAL Education and Government Initiative delivers the highest standards of quantitative research applied to critical policy questions on education. Researchers partner with education practitioners and governments to test, adapt and scale a wide range of promising interventions including returns to girls for completing school, digital support to secondary school teaching, and innovations in skills training for employability. Cost data is collected throughout, supporting evidence-based investment and dis-investment decisions by donors and country governments. JPAL is building the evidence base on interventions to support marginalised children following Covid-19 school closures, and directly responds to the manifesto commitment on girls' education.",144625.00,2022-04-01,2023-03-31,General Grant - Uncompeted,12,Foreign aid,International Development Act 2002
"Foreign, Commonwealth & Development Office","Foreign, Commonwealth & Development Office",G2-SCH-2024-02-14147,Strategic Partnership on Agriculture and Food Systems for Nutrition,"This programme will contribute to improved food and nutrition security through effective  agriculture interventions and food systems that make nutritous food accessible , acceptable and available to all, particularly woman and young children in poor households..  It includes large-scale studies in Africa and South Asia on the impact and cost effectiveness of agricultural interventions on nutrition and health outcomes, and interdisciplinary studies on the drivers of food choices which influence healthy, safe and nutritious diets.",1528696.12,2022-04-01,2023-03-31,General Grant - Uncompeted,12,Foreign aid,International Development Act 2002
"Foreign, Commonwealth & Development Office","Foreign, Commonwealth & Development Office",G2-SCH-2024-02-14148,Asia Regional Trade and Connectivity Programme (ARTCP),Asia Regional Trade & Connectivity Programme  - Aga Khan Foundation,442161.72,2022-04-01,2023-03-31,General Grant - Uncompeted,12,Foreign aid,International Development Act 2002
"Foreign, Commonwealth & Development Office","Foreign, Commonwealth & Development Office",G2-SCH-2024-02-14149,Support to Trademark East Africa Rwanda (TMEA) Rwanda Country Programme - Strategy II,The UK will provide up to £25m (2017  2023) to support TMEA's Strategy 2 (S2)  which aims to remove trade-related barriers to inclusive growth in Rwanda and the East African Community (EAC).,2290000.37,2022-04-01,2023-03-31,General Grant - Uncompeted,12,Foreign aid,International Development Act 2002
"Foreign, Commonwealth & Development Office","Foreign, Commonwealth & Development Office",G2-SCH-2024-02-14150,Provision of Technical Assistance to the Syria Crisis Response,To improve the humanitarian advisory services and Monitoring & Evaluation capacity to support the response to the Syria/Iraq crisis. Monitoring and evaluation is a critical tool to ensure learning and enhance capacity to undertake the ability to deliver. Expert humanitarian advisory support is critical to sound decision making.,479097.39,2022-04-01,2023-03-31,General Grant - Uncompeted,12,Foreign aid,International Development Act 2002
"Foreign, Commonwealth & Development Office","Foreign, Commonwealth & Development Office",G2-SCH-2024-02-14151,Africa Clean Energy Programme (ACE),"To deliver increased access to modern, clean, affordable energy for low-income households in Africa by providing support to promote a market-based approach for private sector delivery of off-grid energy services, including standalone solar household systems and mini-grids. Specific outputs include 1. Businesses offering off-grid energy products and services have access to finance and technical assistance for early stage proof of concept, enterprise start-up and business development. 2. Governments have knowledge and tools to identify, implement and enforce relevant policies and regulations. 3. Improved quality assurance and consumer protection for household solar products. 4. African Green Mini-Grids sector supported through policy and market development and knowledge.",2579412.00,2022-04-01,2023-03-31,General Grant - Uncompeted,12,Foreign aid,International Development Act 2002
"Foreign, Commonwealth & Development Office","Foreign, Commonwealth & Development Office",G2-SCH-2024-02-14152,Strengthening Education Systems for Improved Learning,"To improve learning outcomes for all girls and boys through an effective and accountable education system. Support will be directed mainly at primary education but there will be some support for improved pre-primary and secondary education, including through Public Private Partnerships. The programme will ensure that at least 325,000 children (half of whom are girls) are supported to gain a decent education and so contribute to Global Goal 4 on education.",123019.00,2022-04-01,2023-03-31,General Grant - Uncompeted,12,Foreign aid,International Development Act 2002
"Foreign, Commonwealth & Development Office","Foreign, Commonwealth & Development Office",G2-SCH-2024-02-14153,Programme to pilot the use of Development Impact Bonds - a new payment by results tool - to achieve development outcomes (DIBs Pilot).,"This programme will pilot Development Impact Bonds (DIB), a new business model  for tackling complex social problems in international development by financing programmes on a Payment by Results basis. This work will look at building the evidence for the suitability of DIBs in improving the efficiency and effectiveness of development programmes in areas including income generation, health and disability, by supporting a small number of projects designed by other donors or delivery partners where this financing structure is desirable and feasible. Evidence generated through the pilot will help us to understand when DIBs may be an appropriate commissioning tool, how they can be designed to support providers to innovate and deliver better outcomes, and the costs and benefits of using DIBs.",99305.00,2022-04-01,2023-03-31,General Grant - Uncompeted,12,Foreign aid,International Development Act 2002
"Foreign, Commonwealth & Development Office","Foreign, Commonwealth & Development Office",G2-SCH-2024-02-14154,"CGIAR 2017-22, Support to develop and deploy the next generation of agriculture technology to support poor farmers by the international agriculture research organisation the CGIAR, 2017-22","To enable the CGIAR to scale up its research, contributing to the development of new crop varieties which are more productive and tolerant of biotic and abiotic stress.  Development of farming systems which are more resilient, including to the effects of climate change, and more productive, the development of markets and value chains which are better able to deliver benefits to poor people and policies and technology which will directly support better nutritional and health outcomes for the poor.",20541000.00,2022-04-01,2023-03-31,General Grant - Uncompeted,12,Foreign aid,International Development Act 2002
"Foreign, Commonwealth & Development Office","Foreign, Commonwealth & Development Office",G2-SCH-2024-02-14155,Epidemics and Global Health Security Research Programme (Epidemics and GHS),"This programme will accelerate research and development for disease outbreaks (such as COVID19, Ebola etc) with the goal of preventing and tackling epidemics and saving lives in low and middle income countries.  The programme will support the development of new vaccines, diagnostics and treatments for epidemic diseases and provide better evidence about outbreak diseases, to inform more effective preparedness and response activities",3455775.86,2022-04-01,2023-03-31,General Grant - Uncompeted,12,Foreign aid,International Development Act 2002
"Foreign, Commonwealth & Development Office","Foreign, Commonwealth & Development Office",G2-SCH-2024-02-14156,Supporting the Africa-led Movement to End Female Genital Mutilation (FGM): Phase II,This second phase will continue to work with others to support a movement within countries and globally to raise awareness and understanding of Female Genital Mutilation/Cutting (FGM/C) and build support for efforts to end the practice,660000.00,2022-04-01,2023-03-31,General Grant - Uncompeted,12,Foreign aid,International Development Act 2002
"Foreign, Commonwealth & Development Office","Foreign, Commonwealth & Development Office",G2-SCH-2024-02-14157,Infrastructure for Climate Resilient Growth in India,"In line with the UK governments aid policy and revised development partnership with India, the Infrastructure for Climate Resilient Growth (ICRG) programme sees the UK provide world class expertise to improve the impact of the Indian Governments $5 billion per year National Rural Employment Guarantee Scheme. The scheme will help over 5 million people living in three of Indias poorest states  Odisha, Chhattisgarh and Bihar  to increase their incomes and resilience to climate shocks. It guarantees 40 million households per year the opportunity to build small scale works (irrigation, flood defences, forest plantations etc.) to increase their incomes and protect themselves from extreme weather events.  UK support will improve the design and quality of infrastructure built, increase the capacity of the government to deliver its own programmes and influence the policies of the largest programme of this type in the world.",725761.00,2022-04-01,2023-03-31,General Grant - Uncompeted,12,Foreign aid,International Development Act 2002
"Foreign, Commonwealth & Development Office","Foreign, Commonwealth & Development Office",G2-SCH-2024-02-14158,"Partnership to Engage, Reform and Learn (PERL)","The programme works with government and civil society at federal and state levels to reduce inefficiency and corruption in the use of Nigerian resources and therefore improve delivery of services, including for women, girls and persons with disability. It does this in partnership with other DFID programmes supporting service delivery by helping Nigerian stakeholders improve accountability for use of resources including improving processes for raising revenue, allocating resources, planning and programme implementation.",1527410.97,2022-04-01,2023-03-31,General Grant - Uncompeted,12,Foreign aid,International Development Act 2002
"Foreign, Commonwealth & Development Office","Foreign, Commonwealth & Development Office",G2-SCH-2024-02-14159,TEA - Transforming Energy Access,"TEA is the flagship FCDO research and innovation programme supporting early-stage testing and scale-up of innovative technologies and business models that accelerate access to affordable, clean, and modern energy in developing countries, particularly in Sub-Sharan Africa, South Asia, and ASEAN region, enabling sustainable and inclusive growth. TEA has a budget of  £225 million and seeks to improve clean energy access for 25 million people, create 170,000 long-term jobs in the clean energy market, and leverage £1.3 billion from private and public sources for clean energy technology research, innovation and scale-up. It contributes to International Climate Finance (ICF) objectives and is the main FCDO platform for the £1bn UK Ayrton Fund  commitment for clean energy innovation between 2021 and 2026. TEA is being delivered by five lead FCDO partners - Carbon Trust, Innovate UK, Shell Foundation, and ESMAP  and hundreds of downstream partners operating in the clean energy space.",5589427.42,2022-04-01,2023-03-31,General Grant - Uncompeted,12,Foreign aid,International Development Act 2002
"Foreign, Commonwealth & Development Office","Foreign, Commonwealth & Development Office",G2-SCH-2024-02-14160,Building Resilience Through Asset Creation and Enhancement II  South Sudan (ICF Programme),"To reduce hunger gaps, improve long-term food security and mitigate conflict among 400,000 rural poor in five states of South Sudan. By working together beneficiaries earn food or cash in return for identifying and building community assets (such as irrigation ponds).  This enables communities to develop and manage their resources against extreme climate damage and shocks. This will contribute to Sustainable Development Goals 1, 2, 13, 15 and 16 to end poverty and hunger; take action on climate; protect life on land and; promote peaceful and inclusive societies for sustainable development.",4481697.80,2022-04-01,2023-03-31,General Grant - Uncompeted,12,Foreign aid,International Development Act 2002
"Foreign, Commonwealth & Development Office","Foreign, Commonwealth & Development Office",G2-SCH-2024-02-14161,Comic Relief Red Nose Day 2015 - Improving educational opportunities for children in sub-Saharan Africa,"Support for inclusive and quality education in selected countries in sub-Saharan Africa by ensuring that up to 30,000 of the poorest and most disadvantaged children have greater access to improved education.",1442995.00,2022-04-01,2023-03-31,General Grant - Uncompeted,12,Foreign aid,International Development Act 2002
"Foreign, Commonwealth & Development Office","Foreign, Commonwealth & Development Office",G2-SCH-2024-02-14162,Digital Access Programme,"Digital Access  Programme delivery, management and advisory",3193141.35,2022-04-01,2023-03-31,General Grant - Uncompeted,12,Foreign aid,International Development Act 2002
