Funder: Organisation Name,Managed by: Organisation Name,Grant Programme:Code,Grant Programme:Title,Description,FY value,Start Date,End Date,Allocation method,Duration (Months),COFOG: Sector type,Authority Act: Authority Act Name
Home Office,Home Office,G2-SCH-2021-12-10214,Keyham Community Policing Grant,"To enhance the policing presence in Keyham, Plymouth.  This is to provide community reassurance in the wake of the mass shooting that took place in August, which saw the murder of five people, the wounding of two others and the death of the perpetrator in a unprovoked and sustained attack on a small community.  Events were directly witnessed by up to 300 people.",403887.00,2021-04-01,2023-03-31,General Grant - Uncompeted,24,Public order and safety,Criminal Justice and Public Order Act 1994
"Department for Digital, Culture, Media & Sport",Visit Britain and Visit England,G2-SCH-2021-12-10215,ALB - VisitBritain - Destination Management Company and Inbound Tour Operator Amplification and Distribution Fund 2021/22 (Round 1),"The Destination Management Company and Inbound Tour Operator Amplification and Distribution Fund (the Fund) aims to provide financial assistance by way of a cash grant to destination management companies (DMCs) and inbound tour operators for sales and marketing activity in either France, Germany or The United States.  It is a pilot fund aimed at converting pent up demand for inbound travel into visits to Britain in 2022 in a heightened international competitive market place.

The key aims and objectives are, to:
(1) Push Britain travel itineraries with a focus on extending the holiday season and that taps into international source market demand.
(2) Ensure itineraries included in the 2022 trade and consumer programmes of international tour operators in the target overseas markets of France, Germany and The United States.
(3) Deliver marketing activity, involving third party media buy, to promote those Britain itineraries to trade and consumers in each of the three overseas markets stated above between February and June 2022.
(4) Evidence value add through marketing via its own channels and, where applicable, those of international tour operators.
(5) Provide post-campaign evaluation results showing the actual value (monetary GBP equivalent) and volume (number) of consumer bookings generated bringing incremental visitors to Britain in 2022 in addition to those the DMC or inbound tour operator had already secured.

The scheme will be fully evaluated with successful grant recipients providing data on the actual value (GBP equivalent) and volume (number) of bookings by 30 November 2022.",286070.57,2021-04-01,2023-03-31,General Grant - Competed,24,Economics affairs,Development of Tourism Act 1969
Home Office,Home Office,G2-SCH-2021-12-10224,International Centre for Asset Recovery (ICAR),"Funding the International Centre for Asset Recovery (ICAR), whose legal entity is the Basel Institute of Governance based in Switzerland. ICAR is a centre dedicated to strengthening and supporting the capacities of developing and transition countries to recover stolen public assets. They are a global network and team of asset recovery specialists comprised of former prosecutors, lawyers and financial investigators.",501781.00,2021-04-01,2024-03-31,General Grant - Uncompeted,36,General public services,International Development Act 2002
"Department for Levelling Up, Housing and Communities","Department for Levelling Up, Housing and Communities",G2-SCH-2021-12-10230,Expansion of Waking Watch Relief Fund,"An expansion of the Waking Watch Relief Fund, to install alarms in unsafe buildings with fire safety defects to replace costly waking watch measures",16238947.00,2021-04-01,2024-03-31,General Grant - Criteria Based,36,Housing and community amenities,Infrastructure Act 2015
"Department for Environment, Food and Rural Affairs","Department for Environment, Food and Rural Affairs",G2-SCH-2021-12-10235,Darwin DPLUS R9 (ODA) FY21-22,"4 project grants totalling £983232 (ODA) over 2021/22, 2022/23, 2023/24 and 2024/25 aiding our UK Overseas Territories to protect their native biodiversity and manage environmental issues more effectively, in line with the objectives of Defra's 25-year Environment Plan",314929.00,2021-04-01,2025-03-31,General Grant - Competed,48,Foreign aid,Environmental Protection Act 1990
"Department for Digital, Culture, Media & Sport",Visit Britain and Visit England,G2-SCH-2021-12-10236,ALB  VisitEngland  England for Everyone Programme,"The purpose of this un-competed grant to the charity, Family Holiday Association (FHA) is to provide up to 4,200 subsidised short breaks/day trips in England for low income families and families from disadvantaged backgrounds, living in England and referred to the FHA by their referral network of social workers, teachers, health visitors and other charities between February Half-Term 2022 and 5 June 2022.",951875.00,2021-04-01,2024-03-31,General Grant - Uncompeted,36,"Recreation, culture and religion",Development of Tourism Act 1969
"Department for Environment, Food and Rural Affairs","Department for Environment, Food and Rural Affairs",G2-SCH-2021-12-10238,Darwin Main R25 2019-2023,Main Darwin Initiative projects support projects tackling key threats to biodiversity in developing countries,330073.14,2019-04-01,2023-03-31,General Grant - Competed,48,Foreign aid,Environmental Protection Act 1990
"Department for Environment, Food and Rural Affairs","Department for Environment, Food and Rural Affairs",G2-SCH-2021-12-11012,ODA ICF: Blue Forests,"This project will meet both Defra and ICF objectives by combating mangrove loss. It will work with local communities, the private sector and government to establish improved livelihoods and green business opportunities based on sustainable mangrove forestry and fisheries management",1647619.00,2017-04-01,2025-03-31,General Grant - Uncompeted,96,Foreign aid,International Development Act 2002
Department for Education,Department for Education,G2-SCH-2021-12-11016,Skills Bootcamp - Wave 3,"The funding, which is from the National Skills Fund, must be used to achieve the overall policy objectives of the Skills Bootcamps programme. Skills Bootcamps are intensive, Level 3-5 or equivalent flexible training courses up to 16 weeks, with a guaranteed job interview (in the case of a new job), which equip adults with technical skills that enable them to access in-demand jobs, apprenticeships, new opportunities and an increased level of income over time (including for the self-employed).",31591427.98,2022-04-01,2025-03-31,General Grant - Uncompeted,36,Education,Education Act 2002
"Department for Environment, Food and Rural Affairs",Rural Payments Agency,G2-SCH-2022-01-11051,RPA FARMING INVESTMENT FUND,"The Farming Investment Fund comprises two different sub-schemes. The Farming Equipment and Technology fund will provide lower value grants towards a specified list of items proven to be effective in raising productivity. The Farming Transformation Fund will provide a more flexible model where applicants can seek higher-value investments into more significant infrastructure and equipment. 
The FIF sits alongside other schemes such as those providing business advice (Resilience Fund), R&D (Farming Innovation Programme), environmental land management and improved animal health and welfare. It will support farmers adapt and change to deliver on Defras vision for the future of the agriculture sector. 
 It will aim to increase farmers confidence to invest in novel technologies and practices, during a time of significant sectoral and macroeconomic uncertainty.  
 It will support capital investment, to maximise returns through employing the latest technologies and practices.
 It will support the sector in reducing GHG emissions contributing to Net Zero goals. In addition, it will support improvement in water and air quality. 
 It will support investing and improving animal health and welfare by farmers.
The Farming Investment Fund (FIF) is an evolution of the Countryside Productivity Scheme, following the UKs exit from the EU. The development of the fund has drawn on the experience and evaluation of this predecessor scheme and we have made changes to the design to ensure that it will deliver more effectively an improvement in productivity and the environment in the farming and forestry sectors.",34515000.00,2021-04-01,2025-03-31,General Grant - Competed,48,Environmental protection,The Agriculture Act 2020 and the Agriculture (Financial Assistance)
Home Office,Home Office,G2-SCH-2022-01-11061,Western Balkans SOC Community Coordinator,"This project is designed to deliver this outcome in line with the 4P approach. This will be the first large-scale international SOC Prevent intervention.  The project aims to divert young people in target communities who are at risk, or already involved in SOC, away from SOC to an alternative pathway.  The aim of the project is to reduce to reduce the threats we face from serious and organised crime group in Albania by addressing the risk factors that increases the likelihood of people joining SOC. This will be achieved through activities that will support: 
1. Young People at risk in target communities express an intention to follow an alternative pathway (Prevent Intervention).
2. Core agencies work in partnership to tackle the harm and impact of SOC locally.  
3. Local officials help divert young people away from SOC.
4. Community police officers deliver more effective neighbourhood policing built on effective engagement and consultation with communities.",650000.00,2021-04-01,2024-03-31,General Grant - Uncompeted,36,General public services,Criminal Justice and Public Order Act 1994
Home Office,Home Office,G2-SCH-2022-01-11062,Internet Watch Foundation,"The Internet Watch Foundation (IWF) vision is to create an internet free from child sexual abuse that is a safe place for children and adults to use around the world. IWF detect, disrupt, remove, and prevent online child sexual abuse material using our expertise and resources as effectively as possible.",384116.00,2021-04-01,2024-03-31,General Grant - Uncompeted,36,Public order and safety,"Domestic Violence, Crime and Victims Act 2004"
Home Office,Home Office,G2-SCH-2022-01-11067,National Online Hate Crime Hub,"The hubs main functions are to provide expert case management and victim support in relation to hate crime online. The hub seeks to ensure online cases are effectively investigated and to drive up prosecutions for online hate crimes.

Specially trained officers liaise with the victim/individual reporting and use their knowledge of online hate crime to collect relevant evidence that will be needed by the CPS to bring a prosecution. They also work with the content providers to remove content where appropriate.

Wherever possible, evidence and any preliminary investigative work to identify the perpetrator is then be allocated to the police force in the victims local area to take forward the investigation.  The hub provides local forces with guidance or specialist knowledge.  

This provides victims with a better service, greater central understanding of the issue and makes it more likely that prosecutions can be brought.",300000.00,2021-04-01,2024-03-31,General Grant - Uncompeted,36,General public services,Police Act 1996
"Department for Digital, Culture, Media & Sport",Visit Britain and Visit England,G2-SCH-2022-01-11070,ALB - British Tourist Authority t/a VisitEngland - Destination Management Organisations' Recovery Marketing Fund (No. 2) 2021/23,"The DMOs Recovery Marketing Fund will support recovery of the tourism sector by enabling DMOs in England to run local marketing activations in Spring 2022 aimed at amplifying the reach of the VisitEngland domestic campaign, Escape the Everyday and generate bookings of product experiences via their own DMO websites.

DMOs will need to work with local tourism businesses to create Escape the Everyday guides and content which must include bookable product experiences available for the consumer to purchase on their own destination websites. This will support DMO sustainability and recovery during the pandemic, creating opportunities to directly support their businesses and provide increased choice and information for the consumer in planning and booking domestic breaks and experiences.

The Fund will operate from 14 March to 30 June 2022 as a de minimis grant scheme with a total budget allocation of up to £1,000,000.  DMOs in England that meet the eligibility criteria can apply for grant awards of between £75,000 and £100,000.  A limited number of awards will be made and competition for funds is expected to be high.",727913.30,2021-04-01,2023-03-31,General Grant - Competed,24,Economics affairs,Development of Tourism Act 1969
"Department for Digital, Culture, Media & Sport","Department for Digital, Culture, Media & Sport",G2-SCH-2022-01-11072,Burrell Collection Grant,This funding recognises its important cultural and economic contribution to Scotland and the UK. and will enable the museum - which has undergone a major transformation and is due to reopen in March 2022 - to bring its collections to life and attract new audiences and is intended to consolidate previous HMG investment.,1000000.00,2022-04-01,2025-03-31,General Grant - Uncompeted,36,"Recreation, culture and religion",UK Internal Markets Act 2020
"Department for Digital, Culture, Media & Sport","Department for Digital, Culture, Media & Sport",G2-SCH-2022-01-11073,Park Tennis Court Renovations Programme,To decrease inactivity throughout the UK by renovating park tennis courts nationwide to an acceptable playing standard.,14200000.00,2022-04-01,2024-03-31,General Grant - Uncompeted,24,"Recreation, culture and religion",Charities Act 2006
Department of Health and Social Care,Department of Health and Social Care,G2-SCH-2022-01-11074,Skills for Care - revenue,"Skills for Care is the Departments primary delivery partner for employer-led adult social care workforce development and is responsible for delivering an extensive range of programmes on behalf of the Department, including: Improving recruitment and retention, including apprenticeships and care ambassadors; Maintenance and development of the National Minimum Dataset for Social Care (NMDS-SC) and Integration and workforce development, including dispersal of the Workforce Development Fund (WDF) and the Assessed and Supported Year in Employment (ASYE) scheme.",23000000.00,2022-04-01,2023-03-31,General Grant - Uncompeted,12,Health,Care Standards Act 2000
"Department for Digital, Culture, Media & Sport","Department for Digital, Culture, Media & Sport",G2-SCH-2022-01-11085,Tech Nation 22/23,"Business support is vital for companies survival and growth. The proposed funding aims to 
(1) address the under provision of support across regions and sectors;
(2) increase business and networking skills and promote knowledge sharing via an online growth platform;
(3) promote the UK tech sector via 5 reports and further insights

One year funding extension to Tech Nation as a transitional arrangement whilst DCMS is launching a grant competition in June 2022 for this funding to be competed for the following two financial years (FY23/24, FY24/25).",5905156.00,2022-04-01,2023-03-31,General Grant - Uncompeted,12,"Recreation, culture and religion",Industrial Development Act 1982
"Department for Levelling Up, Housing and Communities","Department for Levelling Up, Housing and Communities",G2-SCH-2022-01-11089,Supporting Families (formerly Troubled Families),Expanded Supporting Families programme. A Department for Education sponsored HMT investment awarded to begin reduction of childrens social care (CSC) policy pressures,204131641.00,2022-04-01,2025-03-31,Formula Grant,36,General public services,Local Government Act 2003
"Department for Levelling Up, Housing and Communities","Department for Levelling Up, Housing and Communities",G2-SCH-2022-01-11090,Levelling Up Parks Fund,To create new or significantly refurbished green spaces in urban areas that need it most,7140000.00,2022-04-01,2023-03-31,General Grant - Competed,12,General public services,Local Government Act 2003
Department for Education,Education and Skills Funding Agency,G2-SCH-2022-01-11091,Schools Supplementary Grant,To distribute the employers NICs cost of the Levy to LAs and Academies.,1195960844.85,2022-04-01,2023-03-31,Formula Grant,12,Education,Children and Families Act 2014
Ministry of Justice,Ministry of Justice,G2-SCH-2022-01-11093,Family court fees inflationary increases - New Burdens s31 Grant,"To provide a budget transfer to individual local authorities in recognition of the impacts on their 2021/22 budgets following inflationary fee increases we have made to family court fees which were introduced on 30 September 2021, following a New Burdens assessment.",1600000.00,2022-04-01,2023-03-31,General Grant - Uncompeted,12,General public services,Local Government Act 2003
Department for Transport,Department for Transport,G2-SCH-2022-01-11097,Project Oval,"To expand contactless system to 233 rail stations by May 2024, Railcards coming to contactless payment cards",30737266.00,2021-04-01,2024-03-31,General Grant - Uncompeted,36,"Recreation, culture and religion",Railways Act 2005
Department of Health and Social Care,Department of Health and Social Care,G2-SCH-2022-01-11114,"Social Care Institute for Excellence (SCIE) - Achieving Stability, Driving Improvement, Integrating Services","The grant is used to facilitate sector improvement, generally by improved awareness, knowledge, skills and experience of the workforce, and also specifically in areas including; safeguarding, strengths-based practice, mental capacity, prevention and dementia, all of which are key policy areas for DHSC.",1585123.00,2022-04-01,2023-03-31,General Grant - Uncompeted,12,Health,Charities Act 2006
Department of Health and Social Care,Department of Health and Social Care,G2-SCH-2022-01-11115,TLAP (hosted by  SCIE) 2022-23,"TLAP comprises of more than 50 partners from across the health and care sector. The partnership includes representation from central government, local government, and people with lived experience, carers, and national bodies, the voluntary, community and social enterprise sector.",708000.00,2022-04-01,2023-03-31,General Grant - Uncompeted,12,Health,Charities Act 2006
Department of Health and Social Care,Department of Health and Social Care,G2-SCH-2022-01-11116,Skills For Care (Capital) 22/23,DHSC main delivery partner for Social Care Workforce development and focuses on four key themes: (1) recruitment & retention: (2) improving quaility of social care through prevention & wellbeing: (3) improving knowledge and skills of workforce (many self-employed) & registered managers: and (4)ensuring that future plans take account of sector experience through workforce intergration.,447467.00,2022-04-01,2023-03-31,General Grant - Uncompeted,12,Health,Care Standards Act 2000
Department of Health and Social Care,Department of Health and Social Care,G2-SCH-2022-01-11117,Care Provider Alliance (CPA),Care Provider Alliance (CPA) brings together eleven organisations representing an estimated 50% of independent and voluntary adult social care providers in England. An umbrella organisation for Adult Social care providers the CPA works at a strategic level to engage the sector and support delivery and implementation of DHSC priority policy areas.,100000.00,2022-04-01,2023-03-31,General Grant - Uncompeted,12,Health,Charities Act 2006
"Department for Environment, Food and Rural Affairs","Department for Environment, Food and Rural Affairs",G2-SCH-2022-01-11124,Future Homes Hub Defra Contribution,"To support the Future Homes Hub - an industry-led initiative that will support housebuilders in England to deliver net zero and the broader environmental objectives being introduced through national policy, including planning reforms and the Environment Bill. Defra want to contribute £50,000 to the Hub to signal a cross-Government commitment to publicly engaging with housebuilders, whilst ensuring that Defra's objectives on placemaking and the wider environment are represented and reflected in their work, embedding an integrated approach to environment in the development process.
Second Year Grant The Future Homes Hub is directly supporting delivery of Defra policy on biodiversity net gain, water efficiency and proposes to convene further work on nutrient neutrality.",68000.00,2021-04-01,2023-03-31,General Grant - Uncompeted,24,Environmental protection,Natural Environment and Rural Communities Act 2006
Ministry of Defence,The Armed Forces Covenant Fund Trust,G2-SCH-2022-02-11126,Armed Forces Families Fund (AF3),The scheme will shape the policy agenda for Armed Forces families for the foreseeable future. The supporting Action Plan will combine existing policies and programmes with new initiatives to create the conditions where Service personnel can have fulfilling careers alongside thriving family lives.  This scheme was set up to combine both the Education Support Fund (ESF) and the Early Learning & Childcare Fund (ELCF).,3552000.00,2022-04-01,2032-03-31,General Grant - Competed,120,Education,Appropriation Act
"Department for Environment, Food and Rural Affairs","Department for Environment, Food and Rural Affairs",G2-SCH-2022-02-11128,NCF: Increasing Peatland Code Capacity and Delivery,"This grant aims to increase the capacity of the team who deliver the Peatland Code at the IUCN UK Peatland Programme. The Peatland Code forms a key pillar of Defra's strategy to increase peatland restoration via private and blended finance. Increasing the capacity of the Peatland Code will unblock barriers to delivering, expanding and improving the Code, leveraging private finance into peatland restoration and therefore saving Exchequer funding in meeting our restoration targets.",50000.00,2022-04-01,2025-03-31,General Grant - Uncompeted,36,Environmental protection,Natural Environment and Rural Communities Act 2006
Home Office,Home Office,G2-SCH-2022-02-11134,The Safer Streets Fund,"The Safer Streets Fund is a Home Office fund that allows police, local authorities and civil society organisations to invest in crime prevention initiatives across England and Wales. It was first launched in 2020 and was originally designed to tackle acquisitive crime (AC) in hotspot areas but has since expanded its remit.",50000000.00,2022-04-01,2025-03-31,General Grant - Competed,36,Public order and safety,Criminal Justice and Public Order Act 1994
Department for Education,Department for Education,G2-SCH-2022-02-11135,Supported Internships,"National Development Team for Inclusion (NDTi) will administer and monitor grants to Local Authorities to ensure all Local Authorities either have access to, establish, or develop SEND Employment Forums. Through a contract with DfE, NDTi will provide support to Local Authorities to improve their Supported Internship provision, amongst other activities.",1768587.98,2022-04-01,2025-03-31,General Grant - Competed,36,Education,Education Act 2002
"Department for Levelling Up, Housing and Communities","Department for Levelling Up, Housing and Communities",G2-SCH-2022-02-11147,Support for Energy Bills: Council Tax Rebate Scheme,Helping to meet rising energy costs through council tax rebate scheme,28047020.00,2021-04-01,2023-03-31,Formula Grant,24,General public services,Local Government Act 2003
"Department for Levelling Up, Housing and Communities","Department for Levelling Up, Housing and Communities",G2-SCH-2022-02-11150,Doubling Of Small Business Rates,Relief is given to all businesses with tapering of the relief for businesses,987697909.00,2020-04-01,2024-03-31,Formula Grant,48,General public services,Local Government Act 2003
Home Office,Home Office,G2-SCH-2022-02-11155,YEF Co-funded Agency Collaboration Round- Focussed Deterrence,"The Home Office will provide a £3 million over 3 years via direct grant to the Youth Endowment Fund (YEF) to support its grant round on Focused Deterrence (Agency Collaboration Fund: Another Chance). 

The Youth Endowment Fund was set up to improve our understanding of what works to reduce serious youth violence. As part of its place-based grant rounds, the YEF is running an Agency Collaboration Fund to understand if, how, and when effective collaboration between (principally statutory) agencies can prevent children and young people from becoming involved in violence. Focused Deterrence is the YEFs first Agency Collaboration Fund grant round. This grant round will test if and how the approach works when there is effective collaboration between agencies.

Focused deterrence is a strategy combining consequences of violence with support for developing positive routes away from it. The YEF rates the intervention as having a high-quality evidence base and high impact on violent crime, although most of the data supporting YEFs assessment is drawn from the USA.",500000.00,2022-04-01,2024-03-31,General Grant - Uncompeted,24,Public order and safety,Criminal Justice and Public Order Act 1994
