"Department for Business, Energy and Industrial Strategy",UK Research and Innovation,G2-SCH-2022-11-12206,UKRI - STFC - Scheme 22/23,research and innovation www.gtr.ukri.org,152144820.00,2021-04-01,2028-03-31,General Grant - Competed,84,General public services,Higher Education and Research Act 2017
"Department for Business, Energy and Industrial Strategy",UK Research and Innovation,G2-SCH-2022-11-12207,UKRI - UKRI - Scheme 22/23,research and innovation www.gtr.ukri.org,8972609.00,2021-04-01,2029-03-31,General Grant - Competed,96,General public services,Higher Education and Research Act 2017
"Department for Environment, Food and Rural Affairs","Department for Environment, Food and Rural Affairs",G2-SCH-2022-11-12212,The Queens Green Canopy Grant,"The primary aims of the QGC fund are as follows.

1) To honour the memory of Her Majesty Queen Elizabeth II by funding tree planting and propagation projects in her name, via the Queens Green Canopy, the only organisation with a direct mandate from HM to plant trees in her name
2) For the aforementioned projects to meet the aims of the Nature for Climate fund. Namely
 To increase tree planting in England
 To deliver a wide range of environmental benefits (e.g. air quality, landscape, biodiversity, recreation)
 To improve peoples access to nature
 To put in place the enablers of future woodland creation

This will contribute towards the following Defra priority outcomes... 
Improving the environment through cleaner air and water, minimised waste, and thriving plants and terrestrial and marine wildlife 

Reducing greenhouse gas emissions and increase carbon storage in the agricultural, waste, peat and tree planting sectors to help deliver net zero",499000.00,2022-04-01,2023-03-31,General Grant - Uncompeted,12,Environmental protection,Environmental Protection Act 1990
Home Office,Home Office,G2-SCH-2022-11-12213,COSIC Eastern Border Project,"Home Office  International Operations has funding for a 3 year programme (FY22-25) to deliver a COSIC (Countering the smuggling of illicit commodities)-funded capacity building project to tackle the cross-border movement of illicit commodities, primarily Class-A drugs, firearms and cash-based proceeds of criminality.  The approach will tackle transnational commodity trafficking in assessed threat origin, nexus and transit countries to maximise global impact at a supply chain level.

The project will also counter organised immigration crime at a critical point in the journey to the UK. Stemming the flow of illegal migration upstream, by reducing the numbers reaching France and attempting to cross The Channel. This is a Home Secretary priority.",1441165.02,2022-04-01,2025-03-31,General Grant - Uncompeted,36,General public services,International Development Act 2002
"Department for Environment, Food and Rural Affairs",Rural Payments Agency,G2-SCH-2022-11-12214,RPA FLY TIPPING GRANT TO LOCAL AUTHORITIES,"The Fly-Tipping Intervention Grant will support approaches and interventions to prevent or address fly-tipping.It will provide capital funding for eligible local authorities in England for projects at known fly-tipping hot-spots that have potential to improve infrastructure, raise awareness, and support enforcement activity.We will prioritise projects designed to influence long-term behaviour change, share knowledge and showcase methods used for the reduction of fly-tipping that can be easily replicated or scaled up within the wider sector.",778000.00,2022-04-01,2024-03-31,General Grant - Competed,24,Environmental protection,Local Government Act 2003
Cabinet Office,Cabinet Office,G2-SCH-2022-11-12225,"Blesma (co-applicant Veterans and Families Institute for Military Social Research, Anglia Ruskin University)",To explore the lived experience of limbless/injured veterans who are wheelchair/electronic powered vehicle users (EPV aka mobility scooters) and to provide a comparison of the effectiveness of selected categories of Assistive Tech devices within the UK veteran community.,50000.00,2022-04-01,2024-03-31,General Grant - Competed,24,Health,Higher Education and Research Act 2017
Department for Education,Department for Education,G2-SCH-2022-11-12229,The Duke of Edinburgh's Award Extension: Support for Disadvantaged Pupils,"Primary objective: to create a fitting legacy for HRH the Duke of Edinburgh that recognises his lifelong  commitment to supporting young peoples development and opportunities, and which helps the Government achieve its objectives particularly with respect to young peoples health and well-being, academic catch-up and employability, and the levelling up agenda.
Specific outcomes: 
1) Identify and work with 291 schools located in IMD 1-4 areas, and schools that support a high proportion of young people from deprived neighbourhoods. With the potential for further support to be provided to IMD 5 and SEND schools in years 2 and 3 of the project.
2) Create a development plan for each school to support uptake and participation.
3) Support these new DofE schools to engage participants, ensuring that young people who are marginalised or who face specific barriers to participation are fully included.",1176431.66,2021-04-01,2023-03-31,General Grant - Uncompeted,24,Education,Education Act 2002
"Department for Environment, Food and Rural Affairs","Department for Environment, Food and Rural Affairs",G2-SCH-2022-11-12230,Science Briefs for COP15,"The aims of this project include:
 Producing an accessible and robust evidence base on science targets: 
o drawing on a wide range of existing credible sources to ensure Parties are well and consistently informed on the targets being negotiated 
o using engaging and impactful communication methods such as infographics, one-pagers and slide pack summaries and webinars to CBD Parties etc.
 Providing neutral experts to provide guidance for Parties at:
o Regional meetings
o COP15",28000.00,2022-04-01,2023-03-31,General Grant - Uncompeted,12,Environmental protection,Environmental Protection Act 1990
Department for Education,Department for Education,G2-SCH-2022-11-12232,International Student Support,To provide bespoke information and support to current and prospective international students in the UK.,338700.00,2021-04-01,2023-03-31,General Grant - Competed,24,Education,The Education (Grant) Regulations 1990
Cabinet Office,Cabinet Office,G2-SCH-2022-11-12233,Forward Assist (co-applicant Salute Her),"The aims of this research are to: a) Identify the mental health support needs of veterans who experience suicidal ideation; b) Co-design and produce practical guidance for Mental Healthcare Professionals, Social Workers and the Military Charity Sector and make recommendations for commissioners to enhance veteran-specific mental health support for who have served in the British Armed Forces; and c) Develop a clear understanding of the multiple and complex issues faced by military veterans with lived experience of sexual assault whilst identifying gaps in service provision.",25000.00,2022-04-01,2024-03-31,General Grant - Competed,24,Health,Charities Act 2006
Cabinet Office,Cabinet Office,G2-SCH-2022-11-12234,Cardiff University - ADVANCE,"Guided self-help using internet-based cognitive behavioural therapy with a trauma focus (CBT-TF) requires less therapist time than face-to-face CBT-TF and allows the recipient to do most of the therapeutic work at a time and location of their choice. Cardiff University carefully developed a guided self-help intervention for PTSD using an internet-based programme, Spring. They have recently completed a large multi-site randomised control trial that demonstrated guided self-help using Spring to be non-inferior to individual face-to-face CBT-TF for mild to moderate PTSD. They are seeking project funding to develop a bespoke military version of the Spring programme.",48960.00,2022-04-01,2024-03-31,General Grant - Competed,24,Health,Higher Education and Research Act 2017
Cabinet Office,Cabinet Office,G2-SCH-2022-11-12235,"Anglia Ruskin University (they will work with Leeds Beckett Uni, KCMHR, the Veterans' Trauma Network and DMWS)","18-month mixed-methods project with the overarching objective of translating existing and new evidence to provide practical and actionable recommendations for solutions to meeting the physical health needs of female veterans. The project will analyse existing datasets and generate a new qualitative dataset with female veterans. They will then co-design recommendations for developing/improving service delivery and care pathways, working directly with female veterans and stakeholders. This project is designed to include engagement with female veterans, the NHS and charitable veteran service providers throughout, to ensure the implementation of the recommendations for service delivery solutions, grounded in real-world experience.",39998.00,2022-04-01,2025-03-31,General Grant - Competed,36,Health,Higher Education and Research Act 2017
Cabinet Office,Cabinet Office,G2-SCH-2022-11-12239,St John and Red Cross Defence Medical Welfare Service (project would involve working with  NHS Lanarkshire and University of the West of Scotland),"DMWS will bring together welfare support and technology to benefit isolated veterans in Lanarkshire in collaboration with Technology Enabled Care. We believe these technologies have incredible potential for improving health and wellbeing of veterans when combined with dedicated welfare support. Many veterans in Lanarkshire are geographically disparate and may struggle accessing health provision; technology enables quicker and easier access to appointments, self-testing solutions and remote befriending and advice services without the need to travel. DMWS will use our expert knowledge and existing connections to identify veterans and introduce assistive technologies, increase uptake, confident use, and wider positive outcomes.",34801.00,2022-04-01,2025-03-31,General Grant - Competed,36,Health,Charities Act 2006
Cabinet Office,Cabinet Office,G2-SCH-2022-11-12240,University of Exeter (project will also involve University of Chester and IonaMind (a Health Technology company),"""This project will develop the UKs first digital-therapeutic app for ex-servicewomen with common mental health issues (the app is the first to deliver AI-supported CBT); undertake an acceptability evaluation with a service-user group and solicit amendments; conduct and publish randomised-control trial of intervention to inform implementation within NHS and wider availability; and inform subsequent definitive randomised control trial.",31018.00,2022-04-01,2025-03-31,General Grant - Competed,36,Health,Higher Education and Research Act 2017
Cabinet Office,Cabinet Office,G2-SCH-2022-11-12241,King's College London (project will also include Combat Stress),"Female veterans drink disproportionally more than female members of the general public. Drinks Ration is the only automated brief digital intervention supporting UK veterans to manage and reduce the amount they drink. In this proposal, we will adapt and evaluate the app to tailor the intervention to the specific needs of female veterans.",43432.00,2022-04-01,2025-03-31,General Grant - Competed,36,Health,Higher Education and Research Act 2017
Cabinet Office,Cabinet Office,G2-SCH-2022-11-12243,Swansea University - ACTIVATE,"Evaluate the efficacy and cost-effectiveness of a new smartphone app to reduce gambling addiction (and the full range of sub-clinical, harmful gambling behaviours) and PTSD symptoms with an innovative clinical therapy called Acceptance and Commitment Therapy (ACT) in veterans with co-existing diagnoses. ACT seeks to increase psychological flexibility and willingness to experience unpleasant sensations by tackling avoidance which lies at the core of suffering with PTSD and gambling addiction.",29995.00,2022-04-01,2025-03-31,General Grant - Competed,36,Health,Higher Education and Research Act 2017
Department of Health and Social Care,UK Health Security Agency,G2-SCH-2022-11-12244,LGBTQ+ Sexual health outreach and engagement,To provide funding for local community groups specialising in communications with the LGBTQ+ community to provide outreach and raise awareness of sexual health risks (including MonkeyPox) in this community.,199990.33,2022-04-01,2023-03-31,General Grant - Competed,12,"Recreation, culture and religion",Charities Act 2006
"Department for Environment, Food and Rural Affairs",Natural England,G2-SCH-2022-11-12246,National Trails Establishment Wainwright Coast to Coast Path,To build on existing paths maintained by 5 lead partners to establish a new coast to coast national trail between St Bees and Robin Hood Bay to the National trails standard,160000.00,2022-04-01,2025-03-31,General Grant - Uncompeted,36,"Recreation, culture and religion",Natural Environment and Rural Communities Act 2006
"Department for Levelling Up, Housing and Communities","Department for Levelling Up, Housing and Communities",G2-SCH-2022-11-12251,Data Accelerator Fund,To support data projects to improve services for children and families,3800000.00,2022-04-01,2024-03-31,General Grant - Competed,24,General public services,Local Government Act 2003
"Department for Levelling Up, Housing and Communities","Department for Levelling Up, Housing and Communities",G2-SCH-2022-11-12252,Voluntary and Community Sector Fund,"The Voluntary, Community and Frontline Sector (VCFS) Grant Programme supports the essential work of the voluntary and community sector in England to deliver a sustained reduction in homelessness and rough sleeping.",2723186.00,2022-04-01,2025-03-31,General Grant - Competed,36,Housing and community amenities,"Housing Grants, Construction and Regeneration Act 1996"
"Department for Environment, Food and Rural Affairs",Rural Payments Agency,G2-SCH-2022-11-12254,RPA Animal Health and Welfare Grants,Offering livestock farmers grants for equipment and technology items or larger infrastructure projects to improve animal health and welfare outcomes. Grants delivered through the Farming Investment Fund.,18000.00,2022-04-01,2026-03-31,General Grant - Competed,48,Environmental protection,The Agriculture Act 2020 and the Agriculture (Financial Assistance)
Department of Health and Social Care,Department of Health and Social Care,G2-SCH-2022-11-12270,Learning Disability and Autism Community Discharge Grant 2022/23,To support the discharge of people with a learning disability and autistic people from inpatient settings back into the community.,20999999.98,2022-04-01,2023-03-31,Formula Grant,12,Health,Local Government Act 2003
Department of Health and Social Care,Department of Health and Social Care,G2-SCH-2022-11-12272,Integrated Care Systems to support Adult Social Care Determination 2022,The aim is to provide funding to Local authorities for digital transformation of adult social care in their area,2131620.00,2022-04-01,2023-03-31,Formula Grant,12,Health,Local Government Act 2003
"Department for Digital, Culture, Media & Sport","Department for Digital, Culture, Media & Sport",G2-SCH-2022-11-12283,PFI Grants to Local Authorities Paid via DLUHC,PFI grants paid to various Local Authorities as required - paid made via DLUHC,28888144.00,2021-04-01,2023-03-31,General Grant - Criteria Based,24,"Recreation, culture and religion",Local Government Act 2003
"Department for Digital, Culture, Media & Sport",Building Digital UK,G2-SCH-2022-11-12287,UK & Rural Gigabit Voucher Scheme 2122 + 2223,"The Government is providing voucher funding as immediate help for people experiencing slow broadband speed. 

For rural areas, the Government is providing up to £210m worth of voucher funding as immediate help for people experiencing slow broadband speeds. Vouchers worth up to £1,500 for homes and £3,500 for businesses help to cover the costs of installing gigabit broadband to peoples doorsteps.",39129975.78,2021-04-01,2023-03-31,General Grant - Criteria Based,24,"Recreation, culture and religion",Industrial Development Act 1982
Department of Health and Social Care,NHS England,G2-SCH-2022-11-12290,NHS Retirement Grant 22/23,"The grant would be spent on enabling the Fellowship to continue their role in ensuring that the dedicated retired workforce that served the NHS is not forgotten, and crucial social networks and relationships are not lost. 

The grant would also ensure that the networks that have been created by the NHS Retirement Fellowship, continue to provide a valuable source of support for retired NHS staff. Which many find such a vital part of their everyday lives and helps them to avoid feeling isolated and lonely. This in turn will ease pressure on current NHS and social care services, which are already facing a constrained environment, so any relief to services would be greatly received. 

The grant would enable the Fellowship to continue to host its staff and volunteers - the Fellowship has 2.9 WTE staff in its headquarters, a small number of part time regional development Officers and volunteers. Without staff to support the Fellowship, the invaluable work that the Fellowship does would be lost and members would not receive the irreplaceable support, advice and guidance. 

NHS England would expect to see the Fellowship to continue to provide its services to its members over the next three years. The Fellowship will also be expected to provide an update to NHS England every six months on their programme of support to their members.",50000.00,2022-04-01,2023-03-31,General Grant - Uncompeted,12,Health,NHS Act 2006
"Department for Digital, Culture, Media & Sport",Visit Britain and Visit England,G2-SCH-2022-12-12294,ALB - VisitEngland - pilot Destination Development Partnership (North-East) 2022-25,"Determining KPIs and measures will form part of the Destination Development Partnership (DDP) set-up and agreement, however the pilot in the North-East aims to achieve the following:

1) The pilot to produce evidence of the positive impact the DDP approach (and multi-year funding model) can have on the visitor economy of the area (including visitor numbers and spend). Which will inform future spending review bids and inform the potential for national roll-out. 

2) Increase the quality and range of destination management activities the accredited DMOs (LVEPs) in the region can undertake. 

3) Increase public sector support (evidenced through inclusion in local strategies and plans) and private sector investment (match funding; inward investment such as hotel development) in the visitor economy in the area. 

4) Increase involvement in local investment, planning and transport decisions with positive outcomes and benefits for the local visitor economy. 

5) Increase support and delivery against national priorities such as levelling up, accessibility and sustainability, distribution and product development.

6) Attract and grow business events in the DDP pilot area (pipeline/number of events and economic value).",750000.00,2022-04-01,2025-03-31,General Grant - Uncompeted,36,"Recreation, culture and religion",Development of Tourism Act 1969
Cabinet Office,Cabinet Office,G2-SCH-2022-12-12298,Bravo Victor (project would involve working with Esme's Umbrella and Moorfields Eye Hospital),"This research will improve understanding of visual hallucinations among military veterans and refine management strategies to ensure individuals receive an accurate diagnosis and appropriate healthcare. The researchers will review practice patterns for veterans presenting with visual hallucinations, establish any differences in prevalence and symptomatology in visual hallucinations between veteran and civilian populations, and test a screening tool and therapeutic toolkit of behavioural interventions to provide respite during hallucinatory episodes.",43713.00,2022-04-01,2025-03-31,General Grant - Competed,36,Health,Charities Act 2006
Cabinet Office,Cabinet Office,G2-SCH-2022-12-12300,Climate Champions Team via Rockefeller Philanthropy Advisors,"The priorities of the Climate Champions were to deliver the following to contribute to the goals of COP26, the UKs Presidency of COP and COP27:   
Deliver a 10x increase in net-zero commitments from non-state actors and strengthen resilience for people and communities most vulnerable to climate change 
Drive  breakthrough industrial systems transformation for 10 sectors    
Support diplomatic efforts through non-state actor channels       
Enhance engagement and agency across state actor groups       
Win the narrative battle on climate action and progress   
Refresh the Marrakech partnership for Global Climate Action to drive a decade of climate action.",40000.00,2022-04-01,2023-03-31,General Grant - Uncompeted,12,Environmental protection,Environmental Protection Act 1990
Home Office,Home Office,G2-SCH-2022-12-12301,VAWG By and For Sector Specialists - SEA,"The Interpersonal Abuse Unit (IAU) is currently funding organisations which provide vital support for victims of VAWG crimes and their families, which includes economic abuse. As part of the Governments commitment to tackling violence against women and VAWG, we are seeking approval to directly award grant funding to Surviving Economic Abuse (SEA) for 36 months for the value of £500,000.00 (financial years 2022/23-2024/25) to provide specialist and expert advocacy to victims of economic abuse. This breaks down to a £100,000 uplift this financial year and then an indicative £200,000 each year for 2023/24 and 2024/25: This delivers on a specific commitment within the Tackling Domestic Abuse Plan, to double funding for the response to economic abuse.",100000.00,2022-04-01,2023-03-31,General Grant - Uncompeted,12,Public order and safety,"Domestic Violence, Crime and Victims Act 2004"
Department for Education,Office for Students,G2-SCH-2022-12-12304,Competitive Capital 2022-25,Competitive capital funding for three year period 2022-25,67904747.00,2022-04-01,2025-03-31,General Grant - Competed,36,Education,Higher Education and Research Act 2017
Department for Education,Office for Students,G2-SCH-2022-12-12305,Supported Validation Pilot,"To support further education colleges (and other providers should they meet 
the aims of the programme) to deliver locally relevant, flexible, full- and part-time higher-level 
skills provision.",1011108.00,2022-04-01,2026-03-31,General Grant - Competed,48,Education,Higher Education and Research Act 2017
Department for Education,Office for Students,G2-SCH-2022-12-12306,Short Course Study Support Bursaries,Additional funding from the DfE of up to £500k in FY 2022-23 for bursary funding for the HE Short Course Trial (HESC).,250002.00,2022-04-01,2023-03-31,General Grant - Competed,12,Education,Higher Education and Research Act 2017
"Department for Environment, Food and Rural Affairs","Department for Environment, Food and Rural Affairs",G2-SCH-2022-12-12307,Falkland Island Flux Towers,"Aim: To create a comprehensive dataset on Falkland peatland GHG emissions, carbon sequestration rates, peat formation/loss and soil erosion, and a feasibility study for carbon offsetting on the Islands. 
Objectives:
- Measure greenhouse gas emissions from both tussac and white-grass peatland habitats on the islands
- Gather data from both intact and degraded peatlands 
- Gather data on peat formation/loss and soil erosion rates to determine soil carbon stores
- Use all data to generate accurate carbon sequestration potential across the peatlands 
- Determine the feasibility for carbon offsetting on the islands to fund peatland restoration 
Outputs: 
- A comprehensive dataset on GHG emissions and carbon sequestration rates for intact and degraded tussac and white-grass peatlands. 
- Peat formation/loss and soil erosion rates for intact and degraded tussac and white-grass peatlands. 
- A locally-led feasibility study for carbon offsetting",581249.00,2022-04-01,2026-03-31,General Grant - Uncompeted,48,Environmental protection,Natural Environment and Rural Communities Act 2006
Department for Education,Office for Students,G2-SCH-2022-12-12308,Teaching Grant 2022-23,Teaching Grant-To support providers teaching costs,860410564.00,2022-04-01,2024-03-31,Formula Grant,24,Education,Higher Education and Research Act 2017
Home Office,Home Office,G2-SCH-2022-12-12309,Home Office Reintegration Programme Albania,"The aim of the programme is to develop and implement consistent and coherent reintegration provision for HMG. Previous reintegration projects were fragmented, rigid, and inflexible, with limited or no access for some returning individuals. A more uniform approach on how reintegration support is provided i therefore required to incentivise return and support potentially vulnerable people.",191613.00,2022-04-01,2025-03-31,General Grant - Competed,36,Public order and safety,"Nationality, Immigration & Asylum Act 2002"
Home Office,Home Office,G2-SCH-2022-12-12310,Home Office Reintegration Programme Bangledesh,"The aim of the programme is to develop and implement consistent and coherent reintegration provision for HMG. Previous reintegration projects were fragmented, rigid, and inflexible, with limited or no access for some returning individuals. A more uniform approach on how reintegration support is provided i therefore required to incentivise return and support potentially vulnerable people.",194893.00,2022-04-01,2025-03-31,General Grant - Competed,36,Public order and safety,"Nationality, Immigration & Asylum Act 2002"
